{
  "jobs": [
    {
      "ffmpeg_commands": [
        {
          "args": [
            "/usr/bin/ffmpeg",
            "-v",
            "error",
            "-nostdin",
            "-y",
            "-i",
            "/home/daniel-boyd/venvs/Projects/mix-marriage-offline/sandbox_tmp/plugin_chain_registry_baseline/renders/2_0/mix.wav",
            "-map_metadata",
            "-1",
            "-map_chapters",
            "-1",
            "-metadata",
            "creation_time=",
            "-metadata",
            "encoder=",
            "-fflags",
            "+bitexact",
            "-flags:a",
            "+bitexact",
            "-threads",
            "1",
            "-f",
            "wav",
            "-c:a",
            "pcm_s16le",
            "/home/daniel-boyd/venvs/Projects/mix-marriage-offline/sandbox_tmp/plugin_chain_registry_baseline/renders/2_0/mix.wav.tmp"
          ],
          "determinism_flags": [
            "-map_metadata",
            "-1",
            "-map_chapters",
            "-1",
            "-metadata",
            "creation_time=",
            "-metadata",
            "encoder=",
            "-fflags",
            "+bitexact",
            "-flags:a",
            "+bitexact",
            "-threads",
            "1"
          ]
        }
      ],
      "ffmpeg_version": "ffmpeg version 6.1.1-3ubuntu5 Copyright (c) 2000-2023 the FFmpeg developers",
      "inputs": [
        {
          "meters": {
            "integrated_lufs": null,
            "peak_dbfs": -4.8843,
            "rms_dbfs": -10.6835
          },
          "path": "/home/daniel-boyd/venvs/Projects/mix-marriage-offline/sandbox_tmp/plugin_chain_registry_baseline/stems/mix.wav",
          "sha256": "eb1244056ae117eb4dcca03c0fea60a169a706dee9e66967a874ae41b7f517ae"
        }
      ],
      "job_id": "JOB.001",
      "outputs": [
        {
          "meters": {
            "integrated_lufs": null,
            "peak_dbfs": 0.0,
            "rms_dbfs": -23.9905
          },
          "path": "/home/daniel-boyd/venvs/Projects/mix-marriage-offline/sandbox_tmp/plugin_chain_registry_baseline/renders/2_0/mix.wav",
          "sha256": "fc4d1e0ed175aebacb78b5471c55c36a5b71e0270eec424ab0d9181af7d4e935"
        }
      ]
    }
  ],
  "plan_sha256": "d7ada4195f49f80404161e152bfa92558a8482eabee38b6f5c0c72ad1641ac4c",
  "request_sha256": "6a8d1689d303261cffc73c68b6a590776fa45f9d22857fd160bae9bb5373f236",
  "run_id": "RUN.1bec25f079a70861",
  "schema_version": "0.1.0"
}
